{
  "schemaVersion": "1.0",
  "executionId": "exec-example-a1b2",
  "sequence": 1,
  "createdAt": "2026-08-01T10:01:00Z",
  "type": "session.bound",
  "sessionId": "session-example-a1b2",
  "payload": {
    "engine": "fake"
  },
  "rawPayloadSha256": "6666666666666666666666666666666666666666666666666666666666666666"
}
